{
  "schemaVersion": 1,
  "id": "medivia",
  "name": "Medivia",
  "description": "MMORPG 2D clássico com experiência old-school e mundo persistente.",
  "assets": {
    "banner": "assets/games/medivia/banner.webp",
    "icon": "assets/games/medivia/icon.webp"
  },
  "installation": {
    "methods": [
      {
        "type": "existing",
        "label": "Localizar instalação existente"
      },
      {
        "type": "archive",
        "label": "Baixar e instalar",
        "url": "https://download.medivia.online/medivia-linux-build.zip",
        "format": "zip",
        "stripTopLevelDir": true,
        "launchAfterInstall": true,
        "headers": {
          "User-Agent": "Mozilla/5.0",
          "Referer": "https://www.tibia.com/account/?subtopic=downloadclient"
        }
      }
    ]
  },
  "launch": {
    "runner": "native",
    "executable": "medivia",
    "args": []
  },
  "verification": {
    "requiredFiles": [
      "medivia"
    ]
  },
  "update": {
    "strategy": "manual"
  }
}
