{
  "schemaVersion": 1,
  "id": "pokemmo",
  "name": "PokeMMO",
  "description": "MMO de criaturas com regiões clássicas, batalhas competitivas e progressão persistente.",
  "assets": {
    "banner": "assets/games/pokemmo/banner.png",
    "icon": "assets/games/pokemmo/icon.svg"
  },
  "installation": {
    "methods": [
      {
        "type": "existing",
        "label": "Localizar instalação existente"
      },
      {
        "type": "archive",
        "label": "Baixar e instalar",
        "url": "https://pokemmo.com/download_file/1/",
        "format": "zip",
        "launchAfterInstall": true
      }
    ]
  },
  "launch": {
    "runner": "native",
    "executable": "PokeMMO.sh",
    "args": []
  },
  "verification": {
    "requiredFiles": [
      "PokeMMO.sh",
      "PokeMMO.exe",
      "data",
      "roms"
    ],
    "checksums": [
      {
        "path": "PokeMMO.sh",
        "algorithm": "crc32",
        "value": "4a98704b"
      }
    ]
  },
  "update": {
    "strategy": "manual"
  }
}
